Index,sentence_id,match_id,masked_text,form_grammatical_nom,form_ungrammatical_dat,form_ungrammatical_erg,p_form_grammatical_nom,I_form_grammatical_nom,p_form_ungrammatical_dat,I_form_ungrammatical_dat,p_form_ungrammatical_erg,I_form_ungrammatical_erg
0,wiki_cytology_00865,1,"[MASK] შედგება გარე შრისა და მის ქვეშ განლაგებული პლაზმური მემბრანისაგან, რომელიც უშუალოდ ციტოპლაზმას შემოსაზღვრავს.",იგი,მას,მან,-505.95457342426664,505.95457342426664,-500.62249813909074,500.62249813909074,-511.54654587414495,511.54654587414495
1,wiki_economics_00942,13,"2007 წელი „ეკონომიკური ბუმის“ პერიოდი იყო, რადგანაც ეკონომიკის 12.3%-იანი [MASK] დაფიქსირდა.",ზრდა,ზრდას,ზრდამ,-373.8159602241872,373.8159602241872,-389.94504090136536,389.94504090136536,-389.76113904870033,389.76113904870033
2,wiki_electrochemistry_01003,4,"ამ ამოცანების შესაბამისი [MASK] განიხილება ელექტროდიკაში, რომელიც სწავლობს ორი ფაზის საზღვარზე მიმდინარე მოვლენებს, ამ მოვლენების თერმოდინამიკას, ფაზათა საზღვრის აგებულებასა და ელექტროქიმიის კინეტიკის კანონებს.",თეორია,თეორიას,თეორიამ,-732.9636498002386,732.9636498002386,-735.8761059165671,735.8761059165671,-739.8375677110045,739.8375677110045
3,wiki_engineering_01052,2,"კომპიუტერული [MASK] ძირითადად წერენ პროგრამებს მიკროკონტროლირებისა და მიკროპროცესორებისთვის, ქმნიან VLSI ჩიპებს, პლატებს და ოპერაციულ სისტემებს შესაბამისი მოწყობილებისთვის.",ინჟინრები,ინჟინრებს,ინჟინრებმა,-758.4225457894397,758.4225457894397,-751.9639613621492,751.9639613621492,-757.1343869603911,757.1343869603911
4,wiki_engineering_01065,5,"კომპიუტერული ინჟინერიის პირველი სასწავლო [MASK] 1972 წელს აშშ-ში, კლივლენდის ერთ-ერთ უნივერსიტეტში დამკვიდრდა.",პროგრამა,პროგრამას,პროგრამამ,-502.9410155000085,502.9410155000085,-515.1635352489517,515.1635352489517,-518.1230927417112,518.1230927417112
5,wiki_entomology_01072,6,"აქვთ 2 წყვილი ფრთა, [MASK] მთლიანად ან ნაწილობრივ დაფარულია ქერცლით, მწუწნავი პირის აპარატი (ხორთუმი).",რომლებიც,რომლებსაც,რომლებმაც,-577.0195813007128,577.0195813007128,-576.7892775100295,576.7892775100295,-567.4315828464281,567.4315828464281
6,wiki_epidemiology_01121,8,1992 წელს ჩამოყალიბდა განსაკუთრებით საშიში პათოგენების კვლევითი [MASK].,ცენტრი,ცენტრს,ცენტრმა,-301.1277412520751,301.1277412520751,-329.0665912108766,329.0665912108766,-328.9505284112547,328.9505284112547
7,wiki_ethics_01141,3,"ჟურნალისტთა ეთიკის [MASK], შექმნილია და მიღებულია 2001 წელს საქართველოს ჟურნალისტთა დამოუკიდებელი ასოციაციას მიერ.",კოდექსი,კოდექსს,კოდექსმა,-311.6584204782113,311.6584204782113,-311.44851818535614,311.44851818535614,-310.21241541512745,310.21241541512745
8,wiki_ethnography_01154,15,"ტერმინი „ეთნოგრაფია“ პირველად 1607 წელს იხმარეს, თუმცა ამ მეცნიერული დისციპლინის აღსანიშნავად [MASK] საბოლოოდ დღემდე არ დამკვიდრებულა.",იგი,მას,მან,-530.3645614300839,530.3645614300839,-529.1620808513464,529.1620808513464,-531.5251782060966,531.5251782060966
9,wiki_fantasy_01178,1,"[MASK] „ეპიკური ფენტეზი“ (ინგლ. high fantasy) პირველად 1971 წელს ლოიდ ალექსანდრის მიერ იქნა გამოყენებული, ესეში „ეპიკური ფენტეზი და ჰეროიკული რომანტიზმი“ (ინგლ. High Fantasy and Heroic Romance).",ტერმინი,ტერმინს,ტერმინმა,-779.8201563304957,779.8201563304957,-742.1445491549447,742.1445491549447,-791.0244946437001,791.0244946437001
10,wiki_geochemistry_01318,1,"[MASK] ემიჯნება გეოლოგიურ, ფიზიკურ და ქიმიურ მეცნიერებებს და ბიოგეოქიმიის საშუალებით უკავშირდება ბიოლოგიას.",იგი,მას,მან,-405.43989642019034,405.43989642019034,-390.55394114203585,390.55394114203585,-417.3633395383586,417.3633395383586
11,wiki_geochemistry_01334,1,[MASK] გეოქიმია მეცნიერებაში შემოიტანა შვეიცარიელმა ქიმიკოსმა კრისტიან ფრიდრიხ შენბაინმა 1838 წ.,ტერმინი,ტერმინს,ტერმინმა,-476.6569668019151,476.6569668019151,-476.6787654638528,476.6787654638528,-459.57139581733657,459.57139581733657
12,wiki_geography_01349,3,გეოგრაფიული გარსის [MASK] იცვლება დროსა და სივრცეში.,განვითარება,განვითარებას,განვითარებამ,-221.5267533656911,221.5267533656911,-230.9249036061026,230.9249036061026,-234.9584735376277,234.9584735376277
13,wiki_history_01509,1,"[MASK] უძველეს ხანაში წარმოიშვა, ხოლო XV-XVI საუკუნეებიდან მეცნიერთა პროფესიული გაერთიანების სახე მიიღო (ხშირად მათ აკადემიებს უწოდებდნენ).",იგი,მას,მან,-501.14956301102615,501.14956301102615,-486.98249876451547,486.98249876451547,-487.90870610488685,487.90870610488685
14,wiki_hydrobiology_01542,10,"ჰიდრობიოლოგია — მეცნიერება იმ ორგანიზმების მთელი კომპლექსის შესახებ, [MASK] წყალში (მტკნარ წყლებში, ზღვებსა და ოკეანეებში) ცხოვრობენ.",რომლებიც,რომლებსაც,რომლებმაც,-635.7759924908587,635.7759924908587,-640.131738035997,640.131738035997,-634.8071101301223,634.8071101301223
15,wiki_ideology_01602,1,"[MASK] გამოიყენება, როგორც პოპულარულ, ისე ფილოსოფიურ ტერმინოლოგიაში.",ტერმინი,ტერმინს,ტერმინმა,-240.51993725458993,240.51993725458993,-227.8555650059054,227.8555650059054,-256.71744678896295,256.71744678896295
16,wiki_international_01675,5,"არსებობს იმდენი საერთაშორისო კერძო [MASK], რამდენი სახელმწიფოცაა მსოფლიოში.",სამართალი,სამართალს,სამართალმა,-167.9903111748184,167.9903111748184,-171.6378833043095,171.6378833043095,-183.66867042968184,183.66867042968184
17,wiki_linguistics_01801,1,"[MASK] მომდინარეობს ლათინური lingua-საგან, რაც ნიშნავს „ენას“.",იგი,მას,მან,-240.24952589282302,240.24952589282302,-239.22491251260294,239.22491251260294,-231.99253303424484,231.99253303424484
18,wiki_linguistics_01802,6,"მონათესავედ მიაჩნიათ ისეთი ენები, [MASK] ერთი ენისგან მომდინარეობენ, ერთი ენის დიალექტთა დიფერენციაციის პროცესში გაჩნდნენ.",რომლებიც,რომლებსაც,რომლებმაც,-506.746296814304,506.746296814304,-508.9962460294861,508.9962460294861,-507.73904139172504,507.73904139172504
19,wiki_literary_01831,1,"[MASK] გვევლინება შემფასებლად, მხატვრული ქმნილების ავ-კარგის განმსაზღვრელად.",იგი,მას,მან,-313.15390930657287,313.15390930657287,-323.1814082097283,323.1814082097283,-303.8761596625643,303.8761596625643
20,wiki_literary_01839,2,"ლიტერატურის [MASK] ეფუძნება ხელოვნების თეორიასა და ფილოსოფიას, მჭიდრო კავშირი აქვს რელიგიასთან, ლინგვისტიკასთან, ესთეტიკასთან, კულტუროლოგიასთან, ანთროპოლოგიასთან, ფსიქოლოგიასთან და ა.შ.",თეორია,თეორიას,თეორიამ,-726.826544935136,726.826544935136,-727.3291399857972,727.3291399857972,-742.194202170989,742.194202170989
21,wiki_literature_01857,5,პოეზიისა და მუსიკის მჭიდრო [MASK] განპირობებულია მათი ძირითადი მასალის ბგერითი ბუნებით.,კავშირი,კავშირს,კავშირმა,-371.0652765631431,371.0652765631431,-374.4055753618829,374.4055753618829,-383.9148706670382,383.9148706670382
22,wiki_management_01907,12,"პროექტის შედეგები (Deliverable) წარმოადგენენ მატერიალურ ან არამატერიალურ ობიექტებს, [MASK] შექმნილია პროექტის ფარგლებში და განსაზღვრულია დამკვეთისთვის გადასაცემად.",რომლებიც,რომლებსაც,რომლებმაც,-506.0162000509,506.0162000509,-510.42929699474195,510.42929699474195,-507.4166028434273,507.4166028434273
23,wiki_material_01948,3,"ამ მასალების [MASK] ტრადიციულად ცალკეულ სეგმენტებად და სპეციალობებად იყოფა, მაგ. დურგლობა, სანტექნიკა, თბოიზოლაცია, გადახურვა და ა.შ.",გამოყენება,გამოყენებას,გამოყენებამ,-595.5893916137967,595.5893916137967,-606.4542418629221,606.4542418629221,-609.4610798751445,609.4610798751445
24,wiki_mathematics_01976,1,"[MASK] ნიშნავს რომ, მისი თითოეული მტკიცებულება - თეორემა მიიღება სხვა უკვე ცნობილი თეორემების საფუძველზე, დამტკიცების საშუალებით.",ეს,ამას,ამან,-399.04350924925825,399.04350924925825,-396.9076313635362,396.9076313635362,-396.66843131199613,396.66843131199613
25,wiki_metallurgy_02038,1,[MASK] „ლითონმცოდნეობა“ შემოიღეს გერმანიაში XX საუკუნის 20-იან წლებში.,ტერმინი,ტერმინს,ტერმინმა,-299.21978384045457,299.21978384045457,-279.91777585202647,279.91777585202647,-283.72232798043655,283.72232798043655
26,wiki_microbiology_02087,3,ამიტომ მათი [MASK] შეიძლება მხოლოდ ელექტრონული მიკროსკოპის საშუალებით.,შესწავლა,შესწავლას,შესწავლამ,-164.22135214464197,164.22135214464197,-172.51319642363097,172.51319642363097,-177.7717726887007,177.7717726887007
27,wiki_morphology_02148,1,[MASK] ორი ნაწილისაგან შედგება: მორფოლოგია და სინტაქსი.,იგი,მას,მან,-211.95321273909116,211.95321273909116,-205.8454276380294,205.8454276380294,-216.5596333765985,216.5596333765985
28,wiki_novel_02192,3,"თემატიკის მიხედვით [MASK] შეიძლება იყოს ისტორიული, სოციალური, ფილოსოფიური, საოჯახო-ყოფითი, სათავგადასავლო, ფანტასტიკური და ა.შ.",რომანი,რომანს,რომანმა,-478.11948834337574,478.11948834337574,-473.03724621968917,473.03724621968917,-472.7376772499348,472.7376772499348
29,wiki_organic_02247,1,"[MASK] მოიცავს დნობის ტემპერატურას, დუღილის ტემპერატურას და რეფრაქციის ინდექსს.",ინფორმაცია,ინფორმაციას,ინფორმაციამ,-416.0878621287437,416.0878621287437,-415.4998032790417,415.4998032790417,-400.8034333545998,400.8034333545998
30,wiki_oriental_02257,2,თავდაპირველად [MASK] უმთავრესად ვითარდებოდა როგორც ფილოლოგიური დისციპლინა.,თურქოლოგია,თურქოლოგიას,თურქოლოგიამ,-390.6638750524549,390.6638750524549,-413.4435474667925,413.4435474667925,-399.11112179865535,399.11112179865535
31,wiki_paleontology_02315,8,პროფესორ გ. ხარატიშვილის სახელობის გეოლოგიისა და პალეონტოლოგიის [MASK] შეიქმნა 1953 წელს.,მუზეუმი,მუზეუმს,მუზეუმმა,-316.5655630834576,316.5655630834576,-340.16321641129264,340.16321641129264,-340.7508108917135,340.7508108917135
32,wiki_paleontology_02318,1,[MASK] ასევე გამოიყენებოდა მნიშვნელოვანი ევოლუციური მოვლენების თარიღების გასაგებად.,იგი,მას,მან,-299.55113510008965,299.55113510008965,-305.151598189547,305.151598189547,-299.5609147938597,299.5609147938597
33,wiki_pharmacology_02373,12,"ანტიბიოტიკები, აგრეთვე, ანტიბაქტერიული საშუალებები — არის ანტიმიკრობული პრეპარატები, [MASK] გამოიყენება ბაქტერიული ინფექციის სამკურნალოდ და პრევენციისთვის.",რომლებიც,რომლებსაც,რომლებმაც,-734.1693026536014,734.1693026536014,-737.9579396033155,737.9579396033155,-736.7403556316912,736.7403556316912
34,wiki_philology_02415,15,"სწორედ მეოცე საუკუნის ქართული არაბისტიკის ერთ–ერთ თვალსაჩინო ფიგურას წარმოადგენს აკადემიკოსი გიორგი წერეთელი, რომლის [MASK] თავისი მნიშვნელოვნებით სცდება საქართველოს ფარგლებს.",შრომები,შრომებს,შრომებმა,-612.0777755341618,612.0777755341618,-610.5386268894295,610.5386268894295,-614.1040006444156,614.1040006444156
35,wiki_philosophy_02431,1,"[MASK] წერს, რომ ისტორიული პროცესის საშუალებით სამყაროს აბსოლუტური გონი სრულყოფასა და თვითრეალიზაციის უმაღლეს ფორმას აღწევს.",იგი,მას,მან,-374.4766821677285,374.4766821677285,-365.15795817298095,365.15795817298095,-370.691643034411,370.691643034411
36,wiki_physical_02484,2,"კატალიზის [MASK] ბუნებაში გავრცელებულია (ცოცხალ ორგანიზმებში მიმდინარე პროცესების უმრავლესობა კატალიტურია) და ფართოდ გამოიყენება ტექნიკაში (ნავთობგადამუშავებასა და ნავთობქიმიაში, გოგირდმჟავის, ამიაკის, აზოტმჟავის წარმოებაში და ა.შ.).",მოვლენა,მოვლენას,მოვლენამ,-1025.4863598727018,1025.4863598727018,-1016.0711615914383,1016.0711615914383,-1038.1839696202226,1038.1839696202226
37,wiki_physical_02500,14,გასული საუკუნის 40-იან წწ. დაიწყო საქართველოსა და მისი რეგიონების ფიზიკურ-გეოგრაფიული (ლანდშაფტური) [MASK].,შესწავლა,შესწავლას,შესწავლამ,-408.76116638769014,408.76116638769014,-422.07201773867894,422.07201773867894,-428.03087937853434,428.03087937853434
38,wiki_physics_02525,3,ყოველი ფიზიკური [MASK] განიხილებოდა როგორც ნაწილაკების ურთიერთქმედებისა და მოძრაობის შედეგი.,მოვლენა,მოვლენას,მოვლენამ,-251.71758550720318,251.71758550720318,-254.12650342538112,254.12650342538112,-260.5303695798314,260.5303695798314
39,wiki_physics_02526,4,ატომური ფიზიკის შემდგომი [MASK] ორი მიმართულებით წარიმართა.,განვითარება,განვითარებას,განვითარებამ,-219.19791423625634,219.19791423625634,-230.244713188416,230.244713188416,-233.3197798560052,233.3197798560052
40,wiki_politics_02585,2,"შემოსავლის [MASK] განსხვავდება „ნებაყოფლობითი“ ხელფასისა და ფასების სახელმძღვანელო პრინციპებიდან ვიდრე სავალდებულო კონტროლისთვის, როგორიცაა ფასის/ხელფასის გაყინვა.",პოლიტიკა,პოლიტიკას,პოლიტიკამ,-592.7165921439422,592.7165921439422,-587.2180813015449,587.2180813015449,-609.1626803461683,609.1626803461683
41,wiki_politics_02592,1,[MASK] დაკავშირებულია „სანიტარულ კორდონთან“ რომელიც შემდგომში ეწოდა სსრკ-ის გეოპოლიტიკურ შეკავებას 1940-იან წლებში.,ტერმინი,ტერმინს,ტერმინმა,-399.7943899914087,399.7943899914087,-404.2214494761416,404.2214494761416,-420.25126322830266,420.25126322830266
42,wiki_psychology_02635,8,"ფილოსოფიურად, ადამიანის გონებისა და მისი პროცესების [MASK] ძველი ბერძნების დროიდან დაიწყო.",შესწავლა,შესწავლას,შესწავლამ,-333.0003389231919,333.0003389231919,-351.94307791877253,351.94307791877253,-351.1462156748604,351.1462156748604
43,wiki_psychology_02638,3,სამედიცინო ფსიქოლოგიის [MASK] არ განსხვავდება ზოგადად ფსიქოლოგიის მეთოდებისაგან.,მეთოდები,მეთოდებს,მეთოდებმა,-244.54549499691805,244.54549499691805,-233.40204732522838,233.40204732522838,-235.13556205728426,235.13556205728426
44,wiki_sinology_02673,7,2007 წელს თბილისის აზიისა და აფრიკის [MASK] თავისუფალი უნივერსიტეტის შემადგენლობაში შევიდა.,ინსტიტუტი,ინსტიტუტს,ინსტიტუტმა,-323.5877392736007,323.5877392736007,-343.5229313420939,343.5229313420939,-354.0425071068262,354.0425071068262
45,wiki_soil_02748,3,ნიადაგების მეცნიერული [MASK] დაიწყო XVIII-XIX სს. მიჯნაზე.,შესწავლა,შესწავლას,შესწავლამ,-239.89566644681437,239.89566644681437,-245.31698678522028,245.31698678522028,-250.9729387929134,250.9729387929134
46,wiki_soil_02751,3,ნიადაგთმცოდნეობის მეცნიერული [MASK] რუსეთში XIX საუკუნის II ნახევარში შეიქმნა და მას გენეზისური მიმართულება მიეცა.,თეორია,თეორიას,თეორიამ,-408.4273348975853,408.4273348975853,-420.4938223273776,420.4938223273776,-425.3522394956936,425.3522394956936
47,wiki_technology_02824,10,"ნანოტექნოლოგიას აქვს პოტენციალი შექმნას მრავალი ახალი მოწყობილობა, რომელთა [MASK] შესაძლებელი იქნება მედიცინაში, ელექტრონიკასა და ენერგეტიკაში.",გამოყენება,გამოყენებას,გამოყენებამ,-472.86084811321507,472.86084811321507,-483.99408676490094,483.99408676490094,-486.52909128953115,486.52909128953115
48,wiki_thermotechnics_02911,8,"თუ ორთქლის კონდენსაციის დროს სითხე წარმოიქმნა, [MASK] ჩამოედინება ზედაპირიდან სიმძიმის ძალის ზემოქმედებით ან წაიტაცება მოძრავი ორთქლით.",იგი,მას,მან,-523.244545196006,523.244545196006,-518.9882319847229,518.9882319847229,-518.2073958154367,518.2073958154367
49,wiki_zoology_02997,12,"იგი იკვლევს ორგანული სამყაროს ისტორიას, იმ ცხოველების ნამარხ ნარჩენებს, [MASK] ცხოვრობდნენ წარსულ გეოლოგიურ ეპოქებში.",რომლებიც,რომლებსაც,რომლებმაც,-464.8588106302842,464.8588106302842,-468.3386958764733,468.3386958764733,-467.39563978890556,467.39563978890556
