Index,sentence_id,match_id,masked_text,form_grammatical_nom,form_ungrammatical_dat,form_ungrammatical_erg,p_form_grammatical_nom,I_form_grammatical_nom,p_form_ungrammatical_dat,I_form_ungrammatical_dat,p_form_ungrammatical_erg,I_form_ungrammatical_erg
50,wiki_automotive_00335,1,"[MASK] სამოქალაქო ინჟინერია XVI საუკუნის ჰოლანდიაში გამოჩნდა და გულისხმობდა გზების და ხიდების მშენებელ სპეციალისტს, პირველი სასწავლო დაწესებულებები ინჟინერთა მოსამზადებლად ჩამოყალიბდა დანიაში XVII საუკუნეში, შემდეგ - დიდ ბრიტანეთში, საფრანგეთში, ავსტრიაში, გერმანიაში და სხვაგან.",ტერმინი,ტერმინს,ტერმინმა,-909.0709808408948,909.0709808408948,-849.2790156233771,849.2790156233771,-870.6395341767177,870.6395341767177
51,wiki_aviation_00374,2,"სააგენტოს [MASK] შედგება საავიაციო უშიშროების დეპარტამენტის, ლიცენზიების სახელმწიფო რეესტრის, საერთაშორისო ურთიერთობების დეპარტამენტისა და ფინანსური და ეკონომიკური დეპარტამენტებისგან.",სტრუქტურა,სტრუქტურას,სტრუქტურამ,-425.0486824377076,425.0486824377076,-421.52101525187186,421.52101525187186,-432.293096878316,432.293096878316
52,wiki_aviation_00381,1,"[MASK] ძირითადად გამოიყენება უძრავფრთიანი თვითმფრინავების აღსანიშნავად, საზღვაო ბაზირების შვეულმფრენებს ოპერაციების ჩატარება უფრო ფართო სპექტრის საზღვაო ხომალდებიდან შეუძლიათ.",ტერმინი,ტერმინს,ტერმინმა,-676.178340672854,676.178340672854,-648.0306732882771,648.0306732882771,-654.1277484513059,654.1277484513059
53,wiki_biochemistry_00428,14,"ლიპიდები (ბერძნ. λίπος, lípos — ცხიმი) — ცხიმისებრი ნივთიერებები, [MASK] ყველა ცოცხალი უჯრედის შედგენილობაში შედის და განსაკუთრებული მნიშვნელობა აქვს სასიცოცხლო პროცესებისათვის - განაპირობებს უჯრედის განვლადობას, მოქმედებს მრავალი ფერმენტის აქტივობაზე, მონაწილეობს ნერვული იმპულსის გადაცემაში, კუნთის შეკუმშვაში, უჯრედებს შორის კონტაქტობის წარმოქმნაში, იმუნოქიმიურ პროცესებში.",რომლებიც,რომლებსაც,რომლებმაც,-1512.163731549829,1512.163731549829,-1513.6051655217252,1513.6051655217252,-1515.5823720660119,1515.5823720660119
54,wiki_bioinformatics_00482,1,"[MASK] ბიოლოგიური საინჟინრო გამოიყენება, აგრეთვე, გარემოსდაცვითი ცვლილებების აღსაწერად: ნიადაგის დაცვა, ფერდობების სტაბილიზაცია, წყლის და სანაპიროს დაცვა, ქარიშხალი, მცენარეული ბარიერები.",ტერმინი,ტერმინს,ტერმინმა,-686.6693987113111,686.6693987113111,-649.5412137864276,649.5412137864276,-656.4488844496314,656.4488844496314
55,wiki_biotechnology_00533,3,"ინსულინის დასამზადებლად [MASK] მცირე რაოდენობით იღებენ ადამიანის უჯრედებს და მისგან გენეტიკურ მასალას (დიენემი) გამოყოფენ, რომელიც ინსულინის დასამზადებელ ინსტრუქციებსაც შეიცავს.",მეცნიერები,მეცნიერებს,მეცნიერებმა,-705.0338754578045,705.0338754578045,-704.572291262753,704.572291262753,-696.0635000950456,696.0635000950456
56,wiki_cellular_00596,1,"[MASK] ძირითადად მოხდა პალეონტოლოგიაში, გარდამავალი ნამარხების და განვითარების ბიოლოგიაში კომპლექსური უჯრედული მექანიზმის შესწავლის გზით.",ეს,ამას,ამან,-450.163237976765,450.163237976765,-457.4766385014345,457.4766385014345,-449.2153700263504,449.2153700263504
57,wiki_children's_00639,7,"იგი მოისყიდის მიგასა და ჟულიოს, [MASK] მთელი ფულით გარბიან და არაფერს უტოვებენ ნეზნაიკასა და კოზლიკს.",რომლებიც,რომლებსაც,რომლებმაც,-423.745762893116,423.745762893116,-424.73788010129556,424.73788010129556,-426.21095120040025,426.21095120040025
58,wiki_computer_00675,2,"იგივე [MASK] შეიძლება იყოს ადამიანისთვის აღქმად ფორმაში, რომელსაც პროგრამის კოდი (ან სორს კოდი) ეწოდება.",პროგრამა,პროგრამას,პროგრამამ,-289.13266526139654,289.13266526139654,-291.07670543812156,291.07670543812156,-294.28753233807146,294.28753233807146
59,wiki_criminal_00753,8,"ფართოდ გავრცელებული აზრის თანახმად, თანამედროვე სისხლის [MASK] ჩაისახა XVIII საუკუნეში, როდესაც ძირითადმა ევროპულმა ქვეყნებმა მიიღეს შესაბამისი საერო კანონმდებლობა და მისი აღსრულების უზრუნველსაყოფად შექმნეს საპოლიციო სისტემები.",სამართალი,სამართალს,სამართალმა,-894.7405712724225,894.7405712724225,-890.7466731355205,890.7466731355205,-904.9044040401699,904.9044040401699
60,wiki_cultural_00794,4,"თანამედროვე მნიშვნელობით, [MASK] კულტურა XVII საუკუნიდან იხმარება.",ტერმინი,ტერმინს,ტერმინმა,-214.4525918880929,214.4525918880929,-214.21391331195258,214.21391331195258,-221.52859562936735,221.52859562936735
61,wiki_agriculture_00040,7,სოფლის მეურნეობის განვითარების საერთაშორისო ფონდის სტრატეგიული [MASK] დეტალურად არის გაწერილი განვითარების საერთაშორისო ფონდის 2011-2015 წლების სტრატეგიაში: სოფლის მოსახლეობის სიღარიბის დაძლევა.,პოლიტიკა,პოლიტიკას,პოლიტიკამ,-475.18236388810567,475.18236388810567,-486.89691625212225,486.89691625212225,-488.56352078060445,488.56352078060445
62,wiki_agriculture_00044,2,"ჩაის [MASK] ბრიტანეთის ინდოეთის დროს განვითარდა, როდესაც ოსტინდოეთის კომპანიამ სილჰეტის რეგიონში ჩაით ვაჭრობა დაიწყო.",მრეწველობა,მრეწველობას,მრეწველობამ,-448.22057811127127,448.22057811127127,-438.812412370009,438.812412370009,-459.2103862081876,459.2103862081876
63,wiki_agrochemistry_00049,1,"[MASK] მჭიდროდ უკავშირდება ნიადაგთმცოდნეობას, მიწათმოქმედებას, მეტეოროლოგიას, მცენარეთა ფიზიოლოგიასა და ბიოქიმიას, სასოფლო-სამეურნეო მიკრობიოლოგიას, ფიზიკას, ქიმიას.",იგი,მას,მან,-812.4763222641336,812.4763222641336,-778.900052143936,778.900052143936,-804.56489113136,804.56489113136
64,wiki_archaeology_00146,11,"არქეოლოგიური ძეგლების დასათარიღებლად გამოიყენება პალეოკლიმატოლოგიის, პალეობოტანიკის, პალეოზოოლოგიის მეცნიერებათა [MASK].",მიღწევები,მიღწევებს,მიღწევებმა,-631.2528098735282,631.2528098735282,-629.6710791288067,629.6710791288067,-641.6956810275587,641.6956810275587
65,wiki_archaeology_00147,10,მასობრივი არქეოლოგიური მასალის შესწავლისას ხშირად გამოიყენება სტატისტიკურ — კომბინატორული [MASK].,მეთოდები,მეთოდებს,მეთოდებმა,-319.22106878873615,319.22106878873615,-320.9933085161057,320.9933085161057,-325.2813810309309,325.2813810309309
66,wiki_art_00196,2,"კრეატიული [MASK] უმეტესწილად იყოფა სხვადასხვა სპეციფიკურ კატეგორიებად, ადვილად გასარჩევ კატეგორიებად, როგორებიცაა მედია, ჟანრი, სტილი და ფორმა.",ხელოვნება,ხელოვნებას,ხელოვნებამ,-518.5849967215679,518.5849967215679,-519.2389895775011,519.2389895775011,-525.4590898302267,525.4590898302267
67,wiki_art_00204,5,"კულტურული შოკი - ეს [MASK] XX საუკუნის 50-იანი წლების მიწურულიდან გვხვდება სამეცნიერო ლიტერატურაში დაძაბულობის, დაურწმუნებლობისა და შფოთვის იმ შეგრძნების აღსანიშნავად, რომელსაც ადამიანი ან ადამიანთა ჯგუფი (მაგალითად, მასობრივი ემიგრაციის შემთხვევაში) განიცდის ახალ და უჩვეულო კულტურულ გარემოში აღმოჩენისას (K. Oberg, Culture Shock and the Problem of Adjusment in New Cultural Enviroments).",ტერმინი,ტერმინს,ტერმინმა,-1655.8139411616835,1655.8139411616835,-1655.994541726619,1655.994541726619,-1668.5408474353367,1668.5408474353367
68,wiki_art_00211,1,[MASK] მუდმივად თანამშრომლობს ხელოვნების სხვა ინსტიტუტებთან გამოფენების თანადაფინანსებისა და მოწყობის მიზნით.,მუზეუმი,მუზეუმს,მუზეუმმა,-278.81837939820065,278.81837939820065,-349.8298548906846,349.8298548906846,-354.7164341047653,354.7164341047653
69,wiki_art_00229,3,"ძირითადად, [MASK] დაკავებულია კულტურული პოლიტიკის ფორმირებით და ქმნის ინფრასტრუქტურას შიდა თანამედროვე ხელოვნების განვითარების პროექტებისთვის.",ცენტრი,ცენტრს,ცენტრმა,-348.84953798083274,348.84953798083274,-351.52042889460716,351.52042889460716,-362.55961793273985,362.55961793273985
