Index,sentence_id,match_id,masked_text,form_grammatical_nom,form_ungrammatical_dat,form_ungrammatical_erg,p_form_grammatical_nom,I_form_grammatical_nom,p_form_ungrammatical_dat,I_form_ungrammatical_dat,p_form_ungrammatical_erg,I_form_ungrammatical_erg,certainty
0,wiki_electricity_00993,6,"დამუხტული სხეულების ურთიერთქმედებას სწავლობს ფიზიკის [MASK] კლასიკური ელექტროდინამიკა, რომელიც სამართლიანია მანამ, სანამ კვანტური ეფექტები უმნიშვნელოა.",დარგი,დარგს,დარგმა,4.1988773746402065e-09,27.827349198126196,3.1531984829041315e-09,28.240536868459486,3.667031917596541e-10,31.34466812564983,0.66
1,wiki_engineering_01049,2,კომპიუტერული [MASK] უმეტესად სწავლობენ ელექტრო და პროგრამულ ინჟინერიას.,ინჟინრები,ინჟინრებს,ინჟინრებმა,3.0078465554200325e-10,31.6305499787268,2.1787104959927392e-13,42.06159072764812,8.520991257375076e-16,50.05982824749851,0.64
2,wiki_environment_01095,1,"[MASK] თავისი სამეურნეო საქმიანობით (ტყის გაშენებით ან გაჩეხვით, ჭაობების ამოშრობით, უდაბნოების მორწყვით და ა.შ.) სახეს უცვლის (გარკვეული ტერიტორიის ფარგლებში) ჰავას, რომელზედაც განსაკუთრებით უარყოფითად მოქმედებს ატმოსფეროს დაჭუჭყიანება.",ადამიანი,ადამიანს,ადამიანმა,0.00459444336593151,7.765894200482857,1.4835449292149867e-05,16.040591854882457,8.430997695541016e-06,16.855865204439038,0.77
3,wiki_epidemiology_01113,1,"[MASK] „ეპიდემია“ გულისხმობს ინფეცქიური დაავადებების (გადამდები) სწრაფ მატებას ან იმ ახალი დაავადებების გავრცელებას, რომლებიც მანამდე არ გვხვდებოდა მოცემულ ტერიტორიაზე.",ტერმინი,ტერმინს,ტერმინმა,0.4388560950756073,1.1881801504702827,0.00034926592567311224,11.48338647904487,1.7487012626059344e-05,15.80335662529642,0.82
4,wiki_ethics_01132,15,"ეთიკის კოდექსს არ გააჩნია კანონის ძალა და ემყარება ადამიანთა ჯგუფის მიერ დადგენილ წესებს, [MASK] თავის მხრივ ითვალისწინებენ საზოგადოებაში დადგენილ მორალურ წესებს და საერთაშორისოდ აღიარებულ ნორმებს ამა თუ იმ სფეროში.",რომლებიც,რომლებსაც,რომლებმაც,0.7240934371948242,0.4657522198443072,0.0005310288979671896,10.878922006618797,0.0003536767326295375,11.465281068127576,0.89
5,wiki_ethics_01145,2,"ღირსების [MASK] მოქმედების მორალურ ღირებულებას პიროვნების ეთიკური გადმოსახედიდან აფასებს, არა როგორც დეონტოლოგია, კონსეკვენციალიზმი, ან პრაგმატული ეთიკა.",ეთიკა,ეთიკას,ეთიკამ,3.3447463743217936e-08,24.83352794087215,5.6990892491171946e-09,27.386621468176283,5.016642885263855e-11,34.21448680169151,0.65
6,wiki_ethnography_01152,3,"ამ სკოლის [MASK] კაცობრიობის კულტურას განიხილავდნენ როგორც პროგრესული განვითარების ერთიან, კანონზომიერ პროცესს.",წარმომადგენლები,წარმომადგენლებს,წარმომადგენლებმა,0.00016726597095839687,12.545568410103181,8.119441190501672e-06,16.91018813002135,1.335514843958663e-05,16.192244463131303,0.65
7,wiki_ethnography_01165,1,[MASK] წარმოადგენს საქართველოს მინიატურულ მოდელს და ასახავს მის მრავალფეროვან ეთნოკულტურას.,მუზეუმი,მუზეუმს,მუზეუმმა,0.00013748752826359128,12.8284116243909,9.72266796795626e-10,29.93792869512627,8.347577357547304e-12,36.80177958074837,0.74
8,wiki_history_01498,10,"სამეცნიერო დაწესებულება არის მეცნიერთა და სხვა პირთა გაერთიანება, [MASK] სამეცნიერო კვლევებს აწარმოებენ.",რომლებიც,რომლებსაც,რომლებმაც,0.04154817387461663,4.58907112071967,0.00012850269558839497,12.92591375654103,6.938775186426942e-05,13.814959449733355,0.64
9,wiki_industry_01633,3,თურქეთის საავტომობილო [MASK] მნიშვნელოვან როლს თამაშობს ქვეყნის ეკონომიკის საწარმოო სექტორში.,მრეწველობა,მრეწველობას,მრეწველობამ,4.8530564527027336e-05,14.330746832228668,2.787979563383545e-07,21.774276678296907,1.3767892661208945e-08,26.11411700426541,0.64
10,wiki_international_01662,7,"საერთაშორისო სამართლის ქვესახეობას წარმოადგენს საერთაშორისო საზღვაო [MASK], საერთაშორისო საჰაერო სამართალი, საერთაშორისო სამართალი კოსმოსური სივრცის გამოყენების თაობაზე, ადამიანის უფლებები, საერთაშორისო ეკონომიკური სამართალი, საერთაშორისო გარემოს დაცვის სამართალი.",სამართალი,სამართალს,სამართალმა,0.006831953302025795,7.193486170822837,1.3812446538672113e-06,19.465599688786938,7.2412112018702426e-09,27.04112182397274,0.63
11,wiki_international_01704,2,"ორივე [MASK] სახელმწიფოს და მის ინტერესებს, როგორც ცენტრალური სუვიექრის ანალიზებს, უპირველესად მიიჩნევს; ნეოლიბერალებს უბრალოდ აქვთ ამ ინტერესების უფრო დიდი კონცეფცია.",თეორია,თეორიას,თეორიამ,0.00021908788767177628,12.156202652769881,2.1514430749577894e-05,15.504335805920316,3.4144992516018354e-07,21.481822646516502,0.6
12,wiki_irrigation_01717,3,ამ მეთოდების [MASK] აუმჯობესებს სასოფლო სამეურნეო კულტურების მოსავლიანობას.,გამოყენება,გამოყენებას,გამოყენებამ,0.0011104810982942581,9.814599447949382,1.2701626474154183e-05,16.2646272250022,5.778364524041711e-06,17.400907351153908,0.67
13,wiki_linguistics_01814,3,"მონათესავე ენათა [MASK] გულისხმობს ლექსიკის (მარტივი ფუძეების ანუ ძირების), ბგერების (ფონემების), ფორმანტებისა და შესიტყვების (სინტაგმის) სტრუქტურის შესწავლას.",შედარება,შედარებას,შედარებამ,3.651997246834074e-07,21.384810986507233,1.986896858050198e-08,25.584907776416532,1.159832245924796e-10,33.00536479479134,0.7
14,wiki_literary_01833,2,"ლიტერატურის [MASK] (პოეტოლოგია) შეისწავლის ზოგად ლიტ. კანონზომიერებებს, ლიტ-რას, როგორც ფენომენს.",თეორია,თეორიას,თეორიამ,1.6280289116821206e-08,25.872298438874314,1.958626751889126e-11,35.57136654891387,4.121065105813435e-18,57.751688452048306,0.77
15,wiki_management_01908,3,სამუშაოს დაშლის [MASK] წარმოადგენს პროექტის ზოგადი დაგეგმვის და კონტროლის სტანდარტულ ჩარჩოს.,სტრუქტურა,სტრუქტურას,სტრუქტურამ,8.381019142689183e-06,16.86444288116278,1.0717374473713526e-09,29.797401334168583,1.7892577747161774e-11,35.70184779526738,0.85
16,wiki_metallurgy_02027,6,"ტექნოლოგიური თვალსაზრისით, მეურნეობის ეს [MASK] მოიცავს ფერადი, კეთილშობილი და იშვიათი ლითონების მოპოვებას, მათ გამდიდრებას და გამოდნობას.",დარგი,დარგს,დარგმა,0.0029066015976804975,8.426450947085545,0.0002574560012561182,11.923386480043204,9.119527887197802e-07,20.064537525394833,0.63
17,wiki_molecular_02130,8,დნმ-ის მოლეკულის ასეთი თვითგაორმაგების უნარის გამო მემკვიდრეული [MASK] თაობიდან თაობას გადაეცემა.,ინფორმაცია,ინფორმაციას,ინფორმაციამ,0.0011610629735514517,9.750338061669165,6.0940528783248754e-06,17.324166550926606,3.454679256609236e-08,24.78687298665598,0.6
18,wiki_music_02171,2,"ეს [MASK] კონკრეტულად ერთ ჟანრს ან ჟღერადობას არ გულისხმობს და მას სხვადასხვაგვარი მნიშვნელობა აქვს, დროისა და ადგილის მიხედვით.",ტერმინი,ტერმინს,ტერმინმა,0.006690436974167822,7.2236838436194075,8.284573887604158e-08,23.524997263951477,1.3398533400529938e-09,29.47527776162998,0.61
19,wiki_novel_02190,3,ეს ვრცელი [MASK] ბოლო ორი საუკუნის საქართველოს სულიერ მდგომარეობას ასახავს და შეუნელებელი ინტერესით იკითხება.,რომანი,რომანს,რომანმა,1.0444271083542838e-06,19.868856760581515,3.686089850993035e-11,34.65911780567294,2.1060482409832962e-10,32.14474246586694,0.61
20,wiki_philology_02400,10,"ანგლისტიკა შეიძლება განიხილებოდეს გერმანისტიკული მეცნიერების ერთ-ერთ დარგადაც, განსაკუთრებით [MASK] შეეხება ენათმეცნიერების სფეროს.",ეს,ამას,ამან,0.12330787628889087,3.019663140077613,2.5048573206731817e-06,18.60684014100135,2.2885846551190525e-09,28.70289719553618,0.76
21,wiki_physics_02511,8,მის ერთ-ერთ ცენტრალურ თემას წარმოადგენს მატერიის აგებულების [MASK].,შესწავლა,შესწავლას,შესწავლამ,2.157918010947667e-10,32.109640897507504,3.2799455425974765e-12,38.14946527687717,8.762048778754747e-20,63.307293651510065,0.99
22,wiki_political_02561,1,"[MASK] პლურალიზმი ნიშნავს განსხვავებული აზრების, მსოფლმხედველობების, ცხოვრების წესის, ინტერესების თანაარსებობას.",ტერმინი,ტერმინს,ტერმინმა,1.322340267506661e-05,16.206547012357476,5.285760485329951e-13,40.78295418018988,2.3516667365602163e-14,45.27330970344356,0.86
23,wiki_politics_02578,6,მონეტარულ პოლიტიკას ძირითადად წარმართავს ცენტრალური [MASK] მონეტარული პოლიტიკის ინსტრუმენტების მეშვეობით.,ბანკი,ბანკს,ბანკმა,0.015016298741102215,6.057326932574049,1.6373487596865737e-05,15.898278821971164,3.60835147148464e-05,14.75830060328484,0.65
24,wiki_politics_02588,8,"ზოგიერთი ეკონომისტი თანხმდება, რომ სანდო შემოსავლის [MASK] ხელს შეუწყობს ინფლაციის თავიდან აცილებას.",პოლიტიკა,პოლიტიკას,პოლიტიკამ,0.014760127291083336,6.082151026545602,5.099338886793699e-05,14.25933025609172,5.049461993488531e-07,20.917366983411362,0.6
25,wiki_sinology_02674,1,"[MASK] მოიცავს როგორც ჩინური ენის 7 დონეს, აგრეთვე ფონეტიკას, ჩინურ კულტურასა და ლიტერატურას, მითოლოგიას, რელიგიებსა და ჩინეთის ისტორიას.",პროგრამა,პროგრამას,პროგრამამ,0.03183653950691224,4.973172660034336,9.845324910884285e-08,23.27598594102827,1.4954080921287857e-06,19.351029324266165,0.8
26,wiki_sociology_02730,1,[MASK] სოციოლოგიას სოციალურ სტატიკად და სოციალურ დინამიკად ყოფდა.,კონტი,კონტს,კონტმა,3.000468344545884e-13,41.59987752427537,6.541913891086582e-14,43.7972805585652,1.7166454400658494e-15,49.0493293307849,0.79
27,wiki_sociology_02732,11,"ფემინიზმი მოიცავს სოციოლოგიურ თეორიებს, პოლიტიკურ და ფილოსოფიურ მოძრაობებს, [MASK] ეხება ქალთა მდგომარეობას სოციალურ, პოლიტიკურ და ეკონომიკურ კონტექსტში.",რომლებიც,რომლებსაც,რომლებმაც,0.002174230525270105,8.845279372800823,7.423502665915292e-06,17.03946850829989,2.1204802180818666e-07,22.169105640087995,0.68
28,wiki_tax_02805,2,"საგადასახადო [MASK] ადგენს ხარჯებს, რომელიც არ შეიძლება გამოიქვითოს.",კოდექსი,კოდექსს,კოდექსმა,3.5630741876957455e-06,18.098446046811006,6.46176222762351e-13,40.49313756856221,2.9113793894507e-12,38.32143428557905,0.88
29,wiki_technology_02823,4,"თანამედროვე კომპიუტერები, [MASK] ეფუძნება ინტეგრირებულ წრედებს, მილიონიდან მილიარდამდე უფრო მეტად უნარიანია, ვიდრე ადრეული მანქანები და იკავებენ მცირე სივრცეს.",რომლებიც,რომლებსაც,რომლებმაც,0.024610392749309536,5.344588508290723,9.437357221031556e-06,16.693185656549336,4.248905497661323e-06,17.844477313122148,0.65
30,wiki_telecommunications_02847,13,"განასხვავებენ ასევე საფოსტო კავშირს, რომელსაც საფუძველი ჩაუყარა წერილობითმა ინფორმაციამ, საფოსტო [MASK] ინფორმაციის მიღება-გადაცემას ფოსტის საშუალებით ახდენს.",კავშირი,კავშირს,კავშირმა,0.00011081989214289932,13.139495511518929,4.959056241204964e-07,20.94343107700345,2.6952548181558423e-08,25.145003082591995,0.66
31,wiki_veterinary_02926,8,"1959 წელს ინსტიტუტს შეუერთდა საქართველოს ვეტერინარიის სამეცნიერო-კვლევითი [MASK] და მან მიიღო საქართველოს ზოოტექნიკურ-სავეტერინარო სასწავლო-კვლევითი ინსტიტუტის, ხოლო 1999 წლის 11 მაისიდან კი საქართველოს სახელმწიფო ზოოტექნიკურ-სავეტერინარო აკადემიის სახელწოდება.",ინსტიტუტი,ინსტიტუტს,ინსტიტუტმა,0.08390972018241882,3.575018246252571,6.023692202640004e-07,20.66284861084676,1.2245228695388427e-07,22.961276945873408,0.77
32,wiki_volcanology_02983,14,"ძლიერი ამონთხევისას ლავა რელიეფის დადაბლებებს ავსებს და გაცივების შემდეგ ჩნდება ლავური განფენი, [MASK] შერჩევითი ეროზიის შედეგად ლავურ პლატოებს (ზეგნებს) წარმოქმნის.",რომლებიც,რომლებსაც,რომლებმაც,0.020976597443222996,5.575075508517921,9.619143384043122e-05,13.3437320513998,0.00017742282943800084,12.460520722797023,0.71
33,wiki_aviation_00388,3,საერთაშორისო საჰაერო [MASK] უპირატესად არეგულირებს სამოქალაქო ავიაციის საქმიანობას.,სამართალი,სამართალს,სამართალმა,5.724053409039703e-08,24.058387625714044,1.4464852051245431e-12,39.33058557141444,6.311771335437033e-16,50.49280457824673,0.68
34,wiki_aviation_00390,9,"ასეთი ფრენების შესრულება რეგულირდება სპეციალური აერსანავიგაციო წესებით, [MASK] ქმნის საერთაშორისო ფრენების რეჟიმს.",რომლებიც,რომლებსაც,რომლებმაც,0.0038699470460414878,8.013470459102741,7.3883884397219e-06,17.046308852255464,8.346431059180766e-06,16.87040913747398,0.62
35,wiki_banking_00411,3,საქართველოს ეროვნული [MASK] წარმოადგენს საქართველოს ცენტრალურ ბანკს და მისი სტატუსი განსაზღვრულია ქვეყნის კონსტიტუციით.,ბანკი,ბანკს,ბანკმა,0.0006127566448412836,10.672398155532669,1.6898620742722402e-06,19.174663070085206,5.0264343798289754e-08,24.245889406116323,0.73
36,wiki_bioinformatics_00481,25,"ამ პრობლემის გადასაჭრელად, ინჟინრები, რომელთაც სურდათ ბიოლოგიური ინჟინერიის შესწავლა, უფრო მეტი დროის დათმობა დაიწყეს და კვლევა ჩაუტარეს დეტალებსა და პროცესებს, [MASK] მოიცავენ როგორიცაა ბიოლოგიას, ფსიქოლოგიას და მედიცინას.",რომლებიც,რომლებსაც,რომლებმაც,0.02104639634490013,5.570282959828031,0.004862458445131778,7.684098363870914,4.7591049224138226e-05,14.358950212966885,0.66
37,wiki_biotechnology_00532,8,"თანამედროვე ბიოტექნოლოგიები მეტწილად გენურ ინჟინერიას იყენებენ — [MASK] მარტივ ცხოველთა და მცენარეთა უჯრედებს ცვლიან, რათა სასარგებლო თვისებები მიანიჭონ.",მეცნიერები,მეცნიერებს,მეცნიერებმა,0.0004090859147254377,11.255308515033315,1.1362292879560996e-08,26.391170762972468,0.00010333235695725308,13.240420296573518,0.63
38,wiki_cellular_00578,7,"ძირითადი პროცესი, რომელსაც ცხოველთა ემბრიონული [MASK] მოიცავს არის: ემბრიონული ინდუქცია, მორფოგენეზი, უჯრედების დიფერენცირება, ზრდა და დროის ზოგადი კონტროლი, ევოლუციური განვითარების ბიოლოგის კვლევის პერიოდში.",განვითარება,განვითარებას,განვითარებამ,0.021884785965085033,5.513927915398878,0.0004362386243883519,11.16259486829017,4.380847776072006e-05,14.47843038908923,0.62
39,wiki_cellular_00584,7,"ბიოპოლიმერები — მაღალმოლეკულური ბუნებრივი ნაერთები, [MASK] ყველა ცოცხალი ორგანიზმის სტრუქტურულ საფუძველს წარმოადგენენ და ცხოველმოქმედების პროცესში განმსაზღვრელ როლს ასრულებენ.",რომლებიც,რომლებსაც,რომლებმაც,0.016699748113751408,5.904029847421642,2.4317121642525304e-05,15.327668003788988,2.0304087229305883e-06,18.9097983969919,0.7
40,wiki_cellular_00591,4,"დნმ-ის მოლეკულის ხაზოვანი [MASK] უზრუნველყოფს გენეტიკური ინფორმაციის ჩაწერას, მის გაორმაგებას დნმ-ის მატრიცული სინთეზის დროს და ერთი და იმავე გენის ასლების ე.ი. რნმ-ის მოლეკულების მიღებას.",სტრუქტურა,სტრუქტურას,სტრუქტურამ,1.8280776203027913e-05,15.739313145808616,5.987776573407141e-08,23.993404369107253,2.204189984185271e-08,25.43517618063928,0.69
41,wiki_civil_00652,9,"როგორც წესი, სამოქალაქო საქმეს პირველი ინსტანციით ერთი [MASK] იხილავს.",მოსამართლე,მოსამართლეს,მოსამართლემ,0.0010470667621120806,9.899430851660508,2.7581852513640307e-06,18.46784921172942,4.959185163116461e-07,20.943393571362115,0.62
42,wiki_civil_00666,2,„[MASK] ბატონისშვილის ვახტანგისა“ განსაზღვრავს სახელმწიფოსა და ეკლესიის მესვეურთა სტატუსს.,სამართალი,სამართალს,სამართალმა,3.4143009600140507e-12,38.09154690559529,9.29657462984323e-15,46.61222217750221,4.0546443779021613e-16,51.13127413315985,0.94
